{
	"id": "cto-volunteer-part-time",
	"status": "current",
	"title": "CTO (Volunteer, Part-time)",
	"organization": {
		"name": "Khadije Charity",
		"url": ""
	},
	"location": "IR",
	"duration": "(4 years 10 months)",
	"dynamicDuration": false,
	"dates": {
		"start": {
			"datetime": "2017-12",
			"label": "12/2017"
		},
		"end": {
			"datetime": "2022-09",
			"label": "09/2022"
		}
	},
	"bullets": [
		{
			"id": "founded-and-scaled-the-entire-technical-ecosystem-from-zero-engineered",
			"text": "Founded and scaled the entire technical ecosystem from zero, engineered solutions that directly impacted 110,000+ lives."
		}
	]
}
