{
	"id": "expert-software-solutions-for-business",
	"status": "alternate",
	"title": "Expert - Software Solutions for Business",
	"organization": {
		"name": "WorldSkills IR",
		"url": ""
	},
	"location": "IR",
	"duration": "(5 years 3 months)",
	"dynamicDuration": false,
	"dates": {
		"start": {
			"datetime": "2010-06",
			"label": "06/2010"
		},
		"end": {
			"datetime": "2015-08-16",
			"label": "08/2015"
		}
	},
	"bullets": [
		{
			"id": "coached-and-trained-3-national-medalists-managed-second-stage-of-nation",
			"text": "Coached and trained 3 national medalists; Managed second stage of national team camp for WorldSkills Sao Paulo 2015."
		}
	]
}
