{
	"id": "judge-2025-codie-awards",
	"status": "current",
	"title": "Judge - 2025 CODiE Awards",
	"organization": {
		"name": "CODiE Awards",
		"url": "https://codieawards.com/"
	},
	"location": "IR",
	"duration": "(1 year)",
	"dynamicDuration": true,
	"dates": {
		"start": {
			"datetime": "2025-01",
			"label": "01/2025"
		},
		"end": {
			"datetime": "2025-12",
			"label": "12/2025"
		}
	},
	"bullets": [
		{
			"id": "selected-as-a-2025-judge-to-evaluate-top-global-software-products-recog",
			"text": "Selected as a 2025 judge to evaluate top global software products, recognizing innovation and excellence in technology."
		}
	]
}
